{
  "schema_version": "1.0.0",
  "id": "3f8b0f4e-5c6b-4a8b-9f3d-1e2c3d4e5f6a",
  "title": "Guest Greeting Prompt for Egyptian Hotels",
  "version": "1.0.0",
  "language": "en",
  "country": "EG",
  "industry": "hotels",
  "department": "prompts",
  "priority": "high",
  "owner": "operations@organization.com",
  "last_updated": "2023-10-11T12:00:00Z",
  "prompt_type": "system",
  "prompt_body": "Welcome to {{hotel_name}}, located in the heart of Egypt. We are delighted to have you with us. Please let us know if you have any special requests during your stay. Our front desk and concierge are available 24/7 to assist you. Enjoy your stay and explore the rich cultural heritage of Egypt. If you need recommendations for local attractions or dining options, feel free to ask.",
  "model_target": "gpt-4o",
  "variables": [
    {
      "name": "hotel_name",
      "type": "string",
      "description": "The name of the hotel where the guest is staying",
      "required": true,
      "examples": [
        "Cairo Grand Hotel",
        "Luxor Nile Resort"
      ]
    }
  ],
  "tags": [
    "hotels",
    "prompts",
    "guest-greeting-prompt"
  ],
  "description": "This prompt is designed to provide a warm and welcoming greeting to guests arriving at hotels in Egypt. It emphasizes the availability of hotel services and encourages guests to explore local attractions.",
  "status": "draft",
  "effective_date": "2023-10-11",
  "expiry_date": "2024-10-11",
  "review_date": "2024-04-11",
  "created_by": "operations@organization.com",
  "approved_by": "manager@organization.com",
  "temperature": 0.7,
  "max_tokens": 150,
  "output_format": "text",
  "chain_of_thought": false,
  "examples": [
    {
      "input": {
        "hotel_name": "Cairo Grand Hotel"
      },
      "output": "Welcome to Cairo Grand Hotel, located in the heart of Egypt. We are delighted to have you with us. Please let us know if you have any special requests during your stay. Our front desk and concierge are available 24/7 to assist you. Enjoy your stay and explore the rich cultural heritage of Egypt. If you need recommendations for local attractions or dining options, feel free to ask."
    }
  ],
  "guardrails": {
    "max_input_tokens": 50,
    "forbidden_topics": [
      "politics",
      "religion",
      "personal data"
    ],
    "required_disclaimers": [
      "This message is generated for hospitality purposes only."
    ]
  },
  "checksum": "sha256:f26e108a1212485b3eb8f1089ccab42e6cdf24e7bfd2f6b90f172d3a28302cc6"
}