{
  "schema_version": "1.0.0",
  "id": "3f9f8e4b-8c4a-4d5b-9f6e-2c8b4c5d6a7e",
  "title": "Hotel Guest Review Response Prompt",
  "version": "1.0.0",
  "language": "en",
  "country": "EG",
  "industry": "hotels",
  "department": "prompts",
  "priority": "high",
  "owner": "operations@organization.com",
  "last_updated": "2023-10-25T14:30:00Z",
  "prompt_type": "system",
  "prompt_body": "Generate a professional and empathetic response to a guest review for a hotel in Egypt. The response should address the guest's feedback, whether positive or negative, and highlight the hotel's commitment to guest satisfaction. Include specific details about the hotel's amenities or services mentioned in the review, and offer a resolution if the feedback is negative. Maintain a tone that reflects the hotel's brand standards and cultural context of Egypt.",
  "model_target": "gpt-4o",
  "variables": [
    {
      "name": "guest_name",
      "type": "string",
      "description": "The name of the guest who left the review",
      "required": true,
      "examples": [
        "John Doe",
        "Fatima Ali"
      ]
    },
    {
      "name": "review_content",
      "type": "string",
      "description": "The content of the guest's review",
      "required": true,
      "examples": [
        "The room was clean and the staff were friendly.",
        "The air conditioning was not working properly."
      ]
    },
    {
      "name": "hotel_name",
      "type": "string",
      "description": "The name of the hotel",
      "required": true,
      "examples": [
        "Cairo Grand Hotel",
        "Nile View Resort"
      ]
    },
    {
      "name": "response_tone",
      "type": "string",
      "description": "The tone of the response, such as 'formal', 'friendly', or 'apologetic'",
      "required": true,
      "examples": [
        "formal",
        "friendly"
      ]
    },
    {
      "name": "resolution_offer",
      "type": "string",
      "description": "The offer or resolution provided to the guest if the review is negative",
      "required": false,
      "examples": [
        "We would like to offer you a complimentary night stay.",
        "Please contact us directly to resolve this issue."
      ]
    }
  ],
  "tags": [
    "hotels",
    "prompts",
    "review-response-prompt"
  ],
  "description": "This prompt is designed to assist hotel staff in crafting appropriate responses to guest reviews, ensuring alignment with brand standards and cultural sensitivity in Egypt.",
  "status": "draft",
  "effective_date": "2023-10-25",
  "expiry_date": "2024-10-25",
  "review_date": "2024-04-25",
  "created_by": "operations@organization.com",
  "approved_by": "operations@organization.com",
  "temperature": 0.7,
  "max_tokens": 1500,
  "output_format": "text",
  "chain_of_thought": false,
  "examples": [
    {
      "input": {
        "guest_name": "John Doe",
        "review_content": "The room was clean and the staff were friendly.",
        "hotel_name": "Cairo Grand Hotel",
        "response_tone": "friendly"
      },
      "output": "Dear John Doe, thank you for your kind words about Cairo Grand Hotel. We are delighted to hear that you enjoyed your stay and found our staff friendly. We look forward to welcoming you back soon!"
    },
    {
      "input": {
        "guest_name": "Fatima Ali",
        "review_content": "The air conditioning was not working properly.",
        "hotel_name": "Nile View Resort",
        "response_tone": "apologetic",
        "resolution_offer": "We would like to offer you a complimentary night stay."
      },
      "output": "Dear Fatima Ali, we sincerely apologize for the inconvenience you experienced with the air conditioning during your stay at Nile View Resort. We appreciate your feedback and are taking steps to ensure this does not happen again. As a gesture of goodwill, we would like to offer you a complimentary night stay. Please contact us directly to arrange this. Thank you for bringing this to our attention."
    }
  ],
  "guardrails": {
    "max_input_tokens": 500,
    "forbidden_topics": [
      "politics",
      "religion"
    ],
    "required_disclaimers": [
      "This response is generated based on the information provided and aims to maintain the hotel's brand standards."
    ]
  },
  "checksum": "sha256:61e667bea507b55aaf5e605ff4147865ba87724ce2ef5a040dc65a8fb696b0a8"
}